{
  "protocol_version": 1,
  "event": "action_request",
  "request_id": "4f2c0a1e-6b7d-4c8e-9f10-112233445566",
  "sequence": 3,
  "timestamp_ms": 1710000000500,
  "data": {
    "action": "use_item_on_block",
    "params": {
      "item_id": "minecraft:iron_ingot",
      "pos": { "x": 12, "y": 64, "z": -3 },
      "face": "up",
      "hand": "main_hand",
      "hit_offset": { "x": 0.5, "y": 1.0, "z": 0.5 },
      "sneaking": false,
      "max_distance": 4.5
    }
  }
}
